{
  "wojewodztwo": "mazowieckie",
  "wojewodztwo_label": "Mazowieckie",
  "tier": "1b",
  "data_aktualizacji": "2026-04-27",
  "wup_url": "https://wupwarszawa.praca.gov.pl",
  "wup_email": null,
  "wup_telefon": null,
  "operator_bur": "WUP Warszawa",
  "priorytety_wojewodzkie": [
    {
      "kod": "P5",
      "nazwa": "Do weryfikacji",
      "opis": "Priorytety P5-P7 do pobrania ze strony WUP Warszawa"
    }
  ],
  "projekty_bur": [],
  "claudia_note": "TIER 1B - największy rynek w kraju. Warszawa: 38 powiatów.",
  "akcja_tygodnia": null,
  "akcja_tygodnia_target": null
}
