{
  "wojewodztwo": "malopolskie",
  "wojewodztwo_label": "Małopolskie",
  "tier": "1b",
  "data_aktualizacji": "2026-04-27",
  "wup_url": "https://wupkrakow.praca.gov.pl",
  "wup_email": null,
  "wup_telefon": null,
  "operator_bur": "WUP Kraków",
  "priorytety_wojewodzkie": [
    {
      "kod": "P5",
      "nazwa": "Do weryfikacji",
      "opis": "Priorytety P5-P7 do pobrania ze strony WUP Kraków"
    }
  ],
  "projekty_bur": [],
  "claudia_note": "TIER 1B - duży rynek szkoleniowy. Kraków + powiaty."
}